,Ratings,Comments_Title,Actual_Comment,Review_Date_place,Verified_or_Not?,Product_Color
88,4.0 out of 5 stars,Best earbud I got for 800 rs,The price is important 800 rs for which I got a good battery backup along with this earbud and cool color support of boat and good quality but mic of the product is not very good as my other earbuds and neckband but for the price I purchased its the best earbud it was delivered on 30th sep and till today I didn't charged it battery backup is awesome 💯💯 great product,Reviewed in India on 7 October 2024,Verified Purchase,Colour: Cider Cyan
89,4.0 out of 5 stars,Good at price,The product is good at the price which I purchased 👍 i.e. 798Rs.,Reviewed in India on 6 October 2024,Verified Purchase,Colour: Bold Black
90,4.0 out of 5 stars,Boat's airdopes141,It's good in affordable price,Reviewed in India on 1 November 2024,Verified Purchase,Colour: Bold Black
91,4.0 out of 5 stars,Good product,Having nice experience,Reviewed in India on 14 October 2024,Verified Purchase,Colour: Bold Black
92,4.0 out of 5 stars,Product is good for the price range,I have been using them for almost 2 years now and they are still working nice and fine except connectivity issue sometime .,Reviewed in India on 25 October 2024,Verified Purchase,Colour: Cider Cyan
93,4.0 out of 5 stars,Beast mode is best,It is a very good product and all the features are perfectly working. Sound quality is bit low 😞 design is good and fit is nice and it is ease of use . It is a good product in all.....,Reviewed in India on 29 September 2024,Verified Purchase,Colour: Cider Cyan
94,4.0 out of 5 stars,Overall it's a good product.,Better connectivity excellent sound and comfort. Battery seams like little bit less.,Reviewed in India on 12 October 2024,Verified Purchase,Colour: Bold Black
95,4.0 out of 5 stars,Honest review for students,I have,Reviewed in India on 5 November 2024,Verified Purchase,Colour: Bold Black
96,4.0 out of 5 stars,Good,Ki,Reviewed in India on 21 October 2024,Verified Purchase,Colour: Cider Cyan
97,4.0 out of 5 stars,Good product,Enjoy sound 😎,Reviewed in India on 1 November 2024,Verified Purchase,Colour: Bold Black
98,4.0 out of 5 stars,It's ok,Not bad,Reviewed in India on 8 November 2024,Verified Purchase,Colour: Bold Black
