,Ratings,Comments_Title,Actual_Comment,Review_Date_place,Verified_or_Not?,Product_Color
0,5.0 out of 5 stars,V good functional airpods,I've used it for a month now. Battery life is decent. If you take out of the charging box the airpods will work for good 2.5 hrs. Once charged the case will charge the airpods for 2 days easily. Sound quality is clear and crisp. It doesn't weigh much so you won't feel it hanging like a rock. I have dropped the case sone times as well but they work just fine and there is no crack either. It's just that the orientation of the pods in the case is a bit awkward so you may drop it if you try to put it back in the dark. But that's not a problem. Overall it's a good product value for money,Reviewed in India on 17 December 2024,Verified Purchase,Colour: Thunder Blue
1,4.0 out of 5 stars,great product under low price range,"Pros:
1. The level of volume it gets to, is just awesome, it can get incredibly loud so if you're at the gym, these are perfect.
2. Awesome Bass!
3. Noise cancellation is just great, if you simply put them on without even any music playing, u won't be able to hear things around u very well, it's great for places like Gym.
4. Lovely battery life, I've had them a week and only had to charge the case once, that too for just a few minutes. And the earbuds themselves, leave them in case for just five min and you'll be getting battery for a long long while.
5. They are very comfortable, can be used for long periods of time.
6. Affordable!
7. The touch controls are very responsive, tap to pause, double tap right one for next song, double tap left one for either rewind or previous song. Can also pick up calls just by tapping.
8. Multiple ear coverings are provided with it.
9. Type C port

Cons:
1. The sound quality is not bad or anything but it is slightly muffled as compared to good quality headphones etc. The bass is the highlight so it's great for music, but for movies or gaming, you won't get the most crisp audio.
2. Some connectivity issues, sometimes i have to turn my Bluetooth on and off many times for it to work (this is occasional, not a daily or frequent occurrence) [Edit after 1 month use: it's now a very frequent issue]
3. The mic quality is good if you are using your phone, but for some reason the quality is really bad if you are on PC
4. Sometimes on WhatsApp, the mic will not be detected if you are on call with these earbuds, so you will end up having to take them off to accept a call sometimes. (Not an issue if you are the one dialing) i hope it's just a whatsapp issue rather than earbuds issue.

Overall, I needed these for my gym since they play horrible music there (lol) so I'm very very happy with them
Highly recommended for music and/or as a more affordable option as compared to JBL etc.",Reviewed in India on 2 January 2023,Verified Purchase,Colour: Bold Black
2,4.0 out of 5 stars,Best airpods,"The gaming ability was super and functionality was not up to the mark, sound quality while listening it's super but while talking it's just good, and also it's value for money, the Design is so simple and also it was comfort to use.",Reviewed in India on 21 November 2024,Verified Purchase,Colour: Bold Black
3,3.0 out of 5 stars,"Good product, but connectivity issues and sometimes left bud stops working.","It is an okay product, if you can then you should avoid buying it, especially if you are going to use it for multiple devices. If your intended use is going to be a single device, then buying this is not a problem. Apart from the connectivity issues, sometimes the left earbud will stop working altogether. Sometimes the battery dies down a lot quicker than you anticipate.",Reviewed in India on 18 November 2024,Verified Purchase,Colour: Olive Green
4,4.0 out of 5 stars,True review after a week long use .....,"I am writing a true review after around a week long use of these boat airdopes 141 ....
CONS
1. the mic is average and the voice feels a little modulated on the mic provided .
2. the case is little bulky due to longer battery life but you will get used to it in about 2 to 3 days. The case quality is decent but the case lid feels like its built out of crappy plastic and doesnt feel robust or stable in hand.
3. these airdopes are based on bluetooth v 5.0 and later and they will work great with all the devices having the same bluetooth version i.e v5.0 or newer however in case of older versions there is a lot of latency lag. I personally use these with my laptop that has v5.0 and they work great however when i connect them with my android phone which has bluetooth v 4.10 , the experience is horrendous ... there are many problems like latency lag, voice breaks etc even when the bt v.50 is backwards compatible .... i experience this latency lag and voice break during calling , whatsapp calling and playing simple mobile games. Despite all this there is no problem while streaming songs on these airdopes.
4. there is a lot of voice leakage if you use them on 100 percent volume both on laptop and mobile phones you will have to tweak them ... the voice is also kind of high so you will not be able to listen to anything on 100 percent anyhow .... 50 to 60 is an ideal level for all the movies and games as well as music.
5. Your ears will hurt after prolonged usage of these if you dont select the right size of air caps ... 3 sizes are already provided inside the box.
6. The biggest con while using these airdopes on windows is that you cannot use the airdopes and the inbuilt mic together .... windows doesnt allow it even if you try very hard to use both the mic and airdopes output speaker together Its a windows issue but is manageable .
7.Another big problem is that the voice control option is absent on the airdopes and the volume cant be controlled from the airdopes ... you will have to control it from the device which is also a big problem .

PROS-
1. the sound quality and the bass are great .
2. the battery life is great you can easily use them for 7 to 8 hours on continuous usage.
3. They charge very quickly, in a jiffy.
4. They feel even greater if you enable surround sound while using them on windows platform.
5. the connectivity is great too ;as soon as you open the case they will automatically detect and connect to the available devices that you paired them with earlier within seconds.
6. There is literally zero latency and zero lag on these while connected on the same bluetooth version .... i used these on my laptop and played all the games like cs go, valorant, gta 5, and other games but there is no issue while gaming or music.
7.There is a support for mono audio and you can use one airdope at a time instead of using both.
8.Boat has provided a year's warranty on these so they can be easily replaced in case of a damage if the damage occurs within the given time frame .

Overall the product can be optimized a bit more but is still good to use now and is a decent purchase on this price point ; however better options are available if you intend to use it just for calling purpose , better go with something wired or something that comes with older bt versions if you intend to use them with devices with older bluetooth versions .",Reviewed in India on 3 September 2021,Verified Purchase,NA
5,3.0 out of 5 stars,:),"""I'm satisfied with my Airdopes purchase, but they have their strengths and weaknesses. On the positive side, the sound quality is good, making them suitable for music and lectures, which was my primary reason for buying them. The design is also comfortable and lightweight, making them easy to wear for extended periods without feeling painful in the ears.

However, there are some areas for improvement. The voice clarity is just okay, and not exceptional. Additionally, the call quality is not the best, but that wasn't a key factor for me.

Overall, I'd say the Airdopes are a satisfactory choice for anyone looking for a budget-friendly option for listening to music and lectures. Just be aware of the potential drawbacks, and you'll be fine!""",Reviewed in India on 10 November 2024,Verified Purchase,Colour: Bold Black
6,4.0 out of 5 stars,Air buds,These are average built quality some days after the sound quality also decreases.,Reviewed in India on 22 December 2024,Verified Purchase,Colour: Pure White
7,3.0 out of 5 stars,Charging issue,"Although sound quality is tremendous, but there is some issue in connectivity, but after use of some days, left buds not charging so not functioning. Easy to fit, design good but if it provides in shape of OnePlus Nord buds 2r then charging issue would b solved. Feature is above average, use is easy.",Reviewed in India on 6 December 2024,Verified Purchase,Colour: Cider Cyan
8,4.0 out of 5 stars,"Even if its boat , for 1 year only","Bass is 5/5
Connectivity 4/5
Comfort 3/5
Battery 5/5
Negative: comfort, connection length.
Its good mine lasted for one year after that it got affected with connection issue, automatic disconnecting issue. After that 1 side earbud sound got disturbed. Comfort was less , and its a big size too.
I would not recommend to buy this on this recent.",Reviewed in India on 3 December 2024,Verified Purchase,Colour: Bold Black
9,4.0 out of 5 stars,Boat signature clear crystal sound,Music sounds not so better. Voice is clear. Bass is decent. Under ₹800 it's a budget earpod.,Reviewed in India on 12 December 2024,Verified Purchase,Colour: Cider Cyan
10,4.0 out of 5 stars,Review after 1 year of using,"I am writing this review after using the product for one year. The sound quality is nice, battery life is good. The problems are it doesn't come with noise cancellation so it's not recommend using in public or any surrounding with high noise. It good product for listening music and stuff. One of the airbuds broken , it just ripped in to two pieces the build quality can be better.",Reviewed in India on 25 November 2024,Verified Purchase,Colour: Bold Black
11,4.0 out of 5 stars,"Good for Everyday Use, But Connectivity Issues with Mac/iPhone","The earbuds offer good sound quality for normal usage, but they frequently disconnect with Mac and iPhone devices, while working fine with Android. They also support only one Bluetooth connection at a time. If you enjoy high-quality music, the bass is not very pronounced, making them less ideal for audiophiles",Reviewed in India on 28 November 2024,Verified Purchase,Colour: Bold Black
12,4.0 out of 5 stars,Happy with this product,"I bought these earbuds a few days ago and I really liked them. Their sound quality and comfort impressed me.

Sound Quality:- Their sound quality is absolutely good, a little above average, the base is clear, according to me it should be a little more powerful and the treble is also very clear

At last this product is value for money product",Reviewed in India on 25 November 2024,Verified Purchase,Colour: Bold Black
13,4.0 out of 5 stars,1 year,Working fine after 1 year same quality of sound.,Reviewed in India on 16 December 2024,Verified Purchase,Colour: Bold Black
14,4.0 out of 5 stars,Good,After 6 7 months Buds charging stops,Reviewed in India on 14 December 2024,Verified Purchase,Colour: Bold Black
15,4.0 out of 5 stars,Medium,Average,Reviewed in India on 22 December 2024,Verified Purchase,Colour: Cider Cyan
16,4.0 out of 5 stars,Nice product.,Nice built quality and sound quality.,Reviewed in India on 11 December 2024,Verified Purchase,Colour: Cider Cyan
17,4.0 out of 5 stars,Nice one,"Good one.. Long time durable, comfortable",Reviewed in India on 11 December 2024,Verified Purchase,Colour: Bold Black
18,4.0 out of 5 stars,Super but color issue,Idont like this color,Reviewed in India on 12 December 2024,Verified Purchase,Colour: Pure White
19,4.0 out of 5 stars,Good,Nice product good product,Reviewed in India on 11 December 2024,Verified Purchase,Colour: Bold Black
20,4.0 out of 5 stars,Good produced,Very good produced,Reviewed in India on 9 December 2024,Verified Purchase,Colour: Bold Black
21,4.0 out of 5 stars,Nice,Very good product,Reviewed in India on 10 December 2024,Verified Purchase,Colour: Cider Cyan
22,4.0 out of 5 stars,Good product,"Sound quality, functional",Reviewed in India on 7 December 2024,Verified Purchase,Colour: Olive Green
23,4.0 out of 5 stars,Good one,Nice sound quality,Reviewed in India on 8 December 2024,Verified Purchase,Colour: Bold Black
24,4.0 out of 5 stars,Nice,Good,Reviewed in India on 2 December 2024,Verified Purchase,Colour: Bold Black
25,4.0 out of 5 stars,Awesome,Feature and functionality are good,Reviewed in India on 30 November 2024,Verified Purchase,Colour: Pure White
26,3.0 out of 5 stars,ok,"bought with great expectation. after 3 months left side buds battery gets drained much fastrer it falls from 100 to 20 with 10 mins usage. have to manage with right side only.

bought this product keeping in mind brand value boat had created some years back. but m not happy.",Reviewed in India on 17 December 2024,Verified Purchase,Colour: Cider Cyan
27,4.0 out of 5 stars,चागले चालत नाही,हेडफोन्स चालत नाही,Reviewed in India on 29 November 2024,Verified Purchase,Colour: Cider Cyan
28,4.0 out of 5 stars,Nice,Godd voice and comfortable,Reviewed in India on 29 November 2024,Verified Purchase,Colour: Cider Cyan
29,4.0 out of 5 stars,After 3 months,"Battery life good,but microphone and software having issues.",Reviewed in India on 18 November 2024,Verified Purchase,Colour: Bold Black
30,4.0 out of 5 stars,Nice one,Good quality products,Reviewed in India on 24 November 2024,Verified Purchase,Colour: Thunder Blue
31,3.0 out of 5 stars,Bad product overall. Too much cons,"Pros>
Only sound quality is good.
Durable. They're surving after more than a year when they fall atleast once a week from me.

Cons>>>>
Charging speed is slower after 1 year.
Playback time is way less. Earbuds dircharge and starts beeping after 1.5-2 hours of continuous use. Not for binge watching. Their 6 hours claim is false.
Deserves negative rating for microphone quality and Enx noice cancellation... So bad for taking calls as it hears every outside noise and everything but not my voice when I put them on. Had to switch to microphone for a call. You're not heard using these even at your home with a bit of ceiling fan voice... Forget about outdoors lol. Maybe this functions on reverse noice cancellation.
Big and uncomfortable to carry in a pocket but manageable.
Wireless range is poor. Their 10m range claim is false. It doesn't catches signal sometimes from my pocket too.
Not enough features, only single device connectivity at a time.
Stratch prone from day 1.",Reviewed in India on 28 September 2024,Verified Purchase,Colour: Bold Black
32,4.0 out of 5 stars,Very good product,amazing voice,Reviewed in India on 19 November 2024,Verified Purchase,Colour: Bold Black
33,4.0 out of 5 stars,Good,The product I received did not work properly so then i claimed warranty. I got new pair of pods .New are working btr now,Reviewed in India on 8 November 2024,Verified Purchase,Colour: Pure White
34,3.0 out of 5 stars,Working and sound,Left earbud works properly but right one not working correctly. Within small time it is disconnected,Reviewed in India on 8 December 2024,Verified Purchase,Colour: Bold Black
35,4.0 out of 5 stars,Very good,Like it good sound and performance,Reviewed in India on 13 November 2024,Verified Purchase,Colour: Bold Black
36,3.0 out of 5 stars,Touch Sensitivity of the earphones is a big issue,"Everything about the earphone is good, but when u touch the earbud by mistake also the song pauses. U cant even brush ur hair, even with a slight touch the earphone pauses.. This has ro be rectified",Reviewed in India on 7 December 2024,Verified Purchase,Colour: Pure White
37,4.0 out of 5 stars,Good product,Good product,Reviewed in India on 6 November 2024,Verified Purchase,Colour: Bold Black
38,4.0 out of 5 stars,Nice airpods,Budget friendly,Reviewed in India on 17 November 2024,Verified Purchase,Colour: Bold Black
39,4.0 out of 5 stars,Good,Good,Reviewed in India on 16 November 2024,Verified Purchase,Colour: Bold Black
40,4.0 out of 5 stars,Best for listening songs,No mike calling is not that much good,Reviewed in India on 3 November 2024,Verified Purchase,Colour: Cider Cyan
41,4.0 out of 5 stars,.,Ok ok,Reviewed in India on 12 November 2024,Verified Purchase,Colour: Bold Black
42,4.0 out of 5 stars,Thik h,"Sab thik h isme.. but ek problem h jo ki entire model me hi h..
Agr sirf left side ka use kro to kuch der baad disconnect ho jata h",Reviewed in India on 30 October 2024,Verified Purchase,Colour: Cider Cyan
43,4.0 out of 5 stars,NICE. I STRONGLY RECOMMENDED TO OTHERS FOR BUY THIS PRODUCT.,I IMPRESSED,Reviewed in India on 11 November 2024,Verified Purchase,Colour: Pure White
44,4.0 out of 5 stars,Nice product,"It's a good product with good sound , good in this range.",Reviewed in India on 28 October 2024,Verified Purchase,Colour: Bold Black
45,4.0 out of 5 stars,Good,Voice is lightly not clear other than good,Reviewed in India on 1 November 2024,Verified Purchase,Colour: Bold Black
46,3.0 out of 5 stars,Worth it deal,"Totally justified deal- decent sound quality, decent ear grip although in long use little bit hurts, back up is long enough you can binge watch for 4 hrs at least
Although I had it replaced it once under warranty as one ear bud was not charging after some months",Reviewed in India on 24 October 2024,Verified Purchase,Colour: Bold Black
47,3.0 out of 5 stars,God bad,Ears will pain after 1/2 hour useage,Reviewed in India on 17 December 2024,Verified Purchase,Colour: Cider Cyan
48,4.0 out of 5 stars,good,good,Reviewed in India on 14 November 2024,Verified Purchase,Colour: Bold Black
49,3.0 out of 5 stars,Just better not best,"This product quality of listing songs and voice clarity is good, design is good but in term of performance this product is not to much better as they wrote the 48 hrs playback bettry life but I continusely listen the songs and videos within 3 to 4 hrs bettry died.sometime blutooth pairing did not work properly.this product perfectly fit in ear.product is light weight.",Reviewed in India on 12 October 2024,Verified Purchase,Colour: Cider Cyan
50,4.0 out of 5 stars,Good,Nice,Reviewed in India on 13 November 2024,Verified Purchase,Colour: Bold Black
51,4.0 out of 5 stars,Good,Noise cancellation work good but outside sometimes not able to talk on call,Reviewed in India on 30 October 2024,Verified Purchase,Colour: Bold Black
52,4.0 out of 5 stars,Boat,Nice product and battery back up awesome.,Reviewed in India on 3 November 2024,Verified Purchase,Colour: Bold Black
53,3.0 out of 5 stars,Painful,Pain in the ear...,Reviewed in India on 13 December 2024,Verified Purchase,Colour: Bold Black
54,4.0 out of 5 stars,Good earbuds in budget,"Earbuds are good if you are searching for budget friendly earbuds. Sound quality is also good in this price. It can easily fit in your pocket. Design is also good.
But if you want to you it for long hours then your ears might hurt.
Comfortable for short time use.
I am using this for more than a year. Working good. They have very good battery life. My earbuds work atleast for 2-3 days as I use them continuously.
Over all good earbuds in this price.",Reviewed in India on 5 October 2024,Verified Purchase,Colour: Bold Black
55,4.0 out of 5 stars,Sound was good,Batteries was good.charging case was slightly bigger. But earpiece was light weight and comfort.functions are ok.,Reviewed in India on 8 November 2024,Verified Purchase,Colour: Bold Black
56,4.0 out of 5 stars,Impressive and excellent,"I am writing this review after around 3 years of use
Comfort : sometimes it slides from the ear but fits good
Sound quality: excellent in this price range (I bought it for 899 )
Quality: still looks like the new one after three years.
Battery: runs nearby which company promised around 30 hours and 2 to 3 hours buds out of the case.
Design: perfect",Reviewed in India on 19 September 2024,Verified Purchase,Colour: Bold Black
57,4.0 out of 5 stars,Sound and beast mode is great,,Reviewed in India on 15 November 2024,Verified Purchase,Colour: Bold Black
58,3.0 out of 5 stars,Good,One earpiece takes time to start. Mine is the left as usual,Reviewed in India on 15 November 2024,Verified Purchase,Colour: Bold Black
59,4.0 out of 5 stars,Good,Not for journeys use only we use at home,Reviewed in India on 13 October 2024,Verified Purchase,Colour: Pure White
60,4.0 out of 5 stars,Clear calling,Best ear buds. Perfect sound quality. It's pretty.,Reviewed in India on 7 October 2024,Verified Purchase,Colour: Pure White
61,3.0 out of 5 stars,Just ok,Not bad ok,Reviewed in India on 15 December 2024,Verified Purchase,Colour: Bold Black
62,4.0 out of 5 stars,Review of the product after 1 week,"After 1 week of usage of the boAt airdopes 141
Connectivity and sound is good
Battery backup is also ok
Beast mode is ok
Some time there is some range problem the range is too low when we workout we want always carry out phone
Fit wise it is ok and comfortable
Build quality is very poor because one first day of purchase my airdopes has lot of scratches
Nb if you buy this product please also buy a silicon case
After 16 days connectivity issue and pairing issues showing",Reviewed in India on 7 October 2024,Verified Purchase,Colour: Bold Black
63,4.0 out of 5 stars,Ok,Ok,Reviewed in India on 13 October 2024,Verified Purchase,Colour: Bold Black
64,4.0 out of 5 stars,Happy with boat :) Airpods 141,Bought this in 798😊 very clear and battery is good,Reviewed in India on 11 October 2024,Verified Purchase,Colour: Bold Black
65,4.0 out of 5 stars,Excellent,Good,Reviewed in India on 7 November 2024,Verified Purchase,Colour: Bold Black
66,4.0 out of 5 stars,Nice,Value for money.,Reviewed in India on 13 October 2024,Verified Purchase,Colour: Cider Cyan
67,4.0 out of 5 stars,Average quality.,Clear Sound quality. No bass. Middle sound..,Reviewed in India on 15 October 2024,Verified Purchase,Colour: Bold Black
68,4.0 out of 5 stars,Little bit scratch’s on the cas quality can be improved,Sound was good but can improve connection also good overall good product,Reviewed in India on 4 October 2024,Verified Purchase,Colour: Bold Black
69,4.0 out of 5 stars,Good quality,Good quality product,Reviewed in India on 18 October 2024,Verified Purchase,Colour: Pure White
70,3.0 out of 5 stars,Damaged use product,,Reviewed in India on 13 November 2024,Verified Purchase,Colour: Bold Black
71,4.0 out of 5 stars,👍,Mast👌,Reviewed in India on 9 November 2024,Verified Purchase,Colour: Bold Black
72,4.0 out of 5 stars,Awesome,Ok,Reviewed in India on 13 October 2024,Verified Purchase,Colour: Bold Black
73,4.0 out of 5 stars,Osm product ✨,This product is worth of money 💗👀 go and puchase it soon ✨👍,Reviewed in India on 6 October 2024,Verified Purchase,Colour: Bold Black
74,4.0 out of 5 stars,Excellent,Excellent,Reviewed in India on 14 October 2024,Verified Purchase,Colour: Bold Black
75,4.0 out of 5 stars,Good and Bad,"Too damn best airpodes under this price
But the BUDS CASE is worst it can be easily damaged
Mine is not working properly",Reviewed in India on 3 October 2024,Verified Purchase,Colour: Bold Black
76,4.0 out of 5 stars,No,Don’t go for it. The case hinges are delicate and really waste of money.,Reviewed in India on 24 October 2024,Verified Purchase,Colour: Cider Cyan
77,4.0 out of 5 stars,Quality,"Clarity is top notch no doubt there's one problem that I have seen that's leaving earbuds for a minute then 1 earbuds will become disabled, battery life outstanding 😀 👏.",Reviewed in India on 18 October 2024,Verified Purchase,Colour: Bold Black
78,3.0 out of 5 stars,"sound was good , product lifeline bad","worked good for 6 months, then every month it wanted to see the service station and now when out of warranty its not working",Reviewed in India on 11 November 2024,Verified Purchase,Colour: Cider Cyan
79,4.0 out of 5 stars,Good Quality,Sound and change,Reviewed in India on 15 October 2024,Verified Purchase,Colour: Cider Cyan
80,4.0 out of 5 stars,Wow good product thank you,"Nice
Sound quality, Ease of use , fit , nice design",Reviewed in India on 25 October 2024,Verified Purchase,Colour: Bold Black
81,4.0 out of 5 stars,Nice,Comfort,Reviewed in India on 24 October 2024,Verified Purchase,Colour: Olive Green
82,4.0 out of 5 stars,Ok but could be better,"Could be better, cannot croos the barrier for eg. Simple wall.",Reviewed in India on 28 October 2024,Verified Purchase,Colour: Bold Black
83,4.0 out of 5 stars,Very good like it,But noise cancellation is not good but it's ok in this price range,Reviewed in India on 31 October 2024,Verified Purchase,Colour: Bold Black
84,4.0 out of 5 stars,Listening,Clarity,Reviewed in India on 31 October 2024,Verified Purchase,Colour: Cider Cyan
85,4.0 out of 5 stars,Need replacement of left bud...,Left side bud is not working.need replacement in warranty,Reviewed in India on 28 October 2024,Verified Purchase,Colour: Cider Cyan
86,4.0 out of 5 stars,Writing review after an week,"The airdopes is average not good and bad and sound quality is good, design also not comfortable for me, features is good",Reviewed in India on 6 October 2024,Verified Purchase,Colour: Pure White
87,4.0 out of 5 stars,Good product,Product is good but it's get dirty faster,Reviewed in India on 29 October 2024,Verified Purchase,Colour: Bold Black
